{
  "schema": "provenant.lane.exit.v1",
  "pid": 101,
  "pgid": 101,
  "started_at": "2026-10-23T00:00:00Z",
  "ended_at": "2026-10-23T00:01:00Z",
  "last_progress_at": "2026-10-23T00:00:59Z",
  "exit": 0,
  "signal": null,
  "forced": null,
  "terminal_event_seen": true,
  "reaped": true,
  "spared": 0,
  "census_warnings": [],
  "observer_lost": false,
  "io_errors": []
}
